<?xml version="1.0" ?>
<Collection setupver="3.0.1.7" casenumber="SRX000000000000" xmlns:pssd="http://tempuri.org" xmlns:xsi="http://www.w3.org/2001/XMLSchema-instance"
	xsi:noNamespaceSchemaLocation="pssdiag_schema.xsd">
	<Machines>
		<Machine name=".">
			<MachineCollectors>
				<EventlogCollector enabled="true" startup="false" shutdown="true" />
				<PerfmonCollector enabled="true" pollinginterval="5" maxfilesize="256">
					<PerfmonCounters>
						<PerfmonObject name="\MSSQL$%s:Buffer Manager" enabled="true">
							<PerfmonCounter name="\Buffer cache hit ratio" enabled="true" />
							<PerfmonCounter name="\Buffer cache hit ratio base" enabled="true" />
							<PerfmonCounter name="\Page lookups/sec" enabled="true" />
							<PerfmonCounter name="\Free list stalls/sec" enabled="true" />
							<PerfmonCounter name="\Free pages" enabled="true" />
							<PerfmonCounter name="\Total pages" enabled="true" />
							<PerfmonCounter name="\Target pages" enabled="true" />
							<PerfmonCounter name="\Database pages" enabled="true" />
							<PerfmonCounter name="\Reserved pages" enabled="true" />
							<PerfmonCounter name="\Stolen pages" enabled="true" />
							<PerfmonCounter name="\Lazy writes/sec" enabled="true" />
							<PerfmonCounter name="\Readahead pages/sec" enabled="true" />
							<PerfmonCounter name="\Procedure cache pages" enabled="true" />
							<PerfmonCounter name="\Page reads/sec" enabled="true" />
							<PerfmonCounter name="\Page writes/sec" enabled="true" />
							<PerfmonCounter name="\Checkpoint pages/sec" enabled="true" />
							<PerfmonCounter name="\AWE lookup maps/sec" enabled="true" />
							<PerfmonCounter name="\AWE stolen maps/sec" enabled="true" />
							<PerfmonCounter name="\AWE write maps/sec" enabled="true" />
							<PerfmonCounter name="\AWE unmap calls/sec" enabled="true" />
							<PerfmonCounter name="\AWE unmap pages/sec" enabled="true" />
							<PerfmonCounter name="\Page life expectancy" enabled="true" />
						</PerfmonObject>
						<PerfmonObject name="\MSSQL$%s:Buffer Partition(0)" enabled="true">
							<PerfmonCounter name="\Free pages" enabled="true" />
							<PerfmonCounter name="\Free list requests/sec" enabled="true" />
							<PerfmonCounter name="\Free list empty/sec" enabled="true" />
						</PerfmonObject>
						<PerfmonObject name="\MSSQL$%s:General Statistics" enabled="true">
							<PerfmonCounter name="\Logins/sec" enabled="true" />
							<PerfmonCounter name="\Logouts/sec" enabled="true" />
							<PerfmonCounter name="\User Connections" enabled="true" />
						</PerfmonObject>
						<PerfmonObject name="\MSSQL$%s:Locks(Extent)" enabled="true">
							<PerfmonCounter name="\Lock Requests/sec" enabled="true" />
							<PerfmonCounter name="\Lock Timeouts/sec" enabled="true" />
							<PerfmonCounter name="\Number of Deadlocks/sec" enabled="true" />
							<PerfmonCounter name="\Lock Waits/sec" enabled="true" />
							<PerfmonCounter name="\Lock Wait Time (ms)" enabled="true" />
							<PerfmonCounter name="\Average Wait Time (ms)" enabled="true" />
							<PerfmonCounter name="\Average Wait Time Base" enabled="true" />
						</PerfmonObject>
						<PerfmonObject name="\MSSQL$%s:Locks(Key)" enabled="true">
							<PerfmonCounter name="\Lock Requests/sec" enabled="true" />
							<PerfmonCounter name="\Lock Timeouts/sec" enabled="true" />
							<PerfmonCounter name="\Number of Deadlocks/sec" enabled="true" />
							<PerfmonCounter name="\Lock Waits/sec" enabled="true" />
							<PerfmonCounter name="\Lock Wait Time (ms)" enabled="true" />
							<PerfmonCounter name="\Average Wait Time (ms)" enabled="true" />
							<PerfmonCounter name="\Average Wait Time Base" enabled="true" />
						</PerfmonObject>
						<PerfmonObject name="\MSSQL$%s:Locks(Page)" enabled="true">
							<PerfmonCounter name="\Lock Requests/sec" enabled="true" />
							<PerfmonCounter name="\Lock Timeouts/sec" enabled="true" />
							<PerfmonCounter name="\Number of Deadlocks/sec" enabled="true" />
							<PerfmonCounter name="\Lock Waits/sec" enabled="true" />
							<PerfmonCounter name="\Lock Wait Time (ms)" enabled="true" />
							<PerfmonCounter name="\Average Wait Time (ms)" enabled="true" />
							<PerfmonCounter name="\Average Wait Time Base" enabled="true" />
						</PerfmonObject>
						<PerfmonObject name="\MSSQL$%s:Locks(Table)" enabled="true">
							<PerfmonCounter name="\Lock Requests/sec" enabled="true" />
							<PerfmonCounter name="\Lock Timeouts/sec" enabled="true" />
							<PerfmonCounter name="\Number of Deadlocks/sec" enabled="true" />
							<PerfmonCounter name="\Lock Waits/sec" enabled="true" />
							<PerfmonCounter name="\Lock Wait Time (ms)" enabled="true" />
							<PerfmonCounter name="\Average Wait Time (ms)" enabled="true" />
							<PerfmonCounter name="\Average Wait Time Base" enabled="true" />
						</PerfmonObject>
						<PerfmonObject name="\MSSQL$%s:Locks(RID)" enabled="true">
							<PerfmonCounter name="\Lock Requests/sec" enabled="true" />
							<PerfmonCounter name="\Lock Timeouts/sec" enabled="true" />
							<PerfmonCounter name="\Number of Deadlocks/sec" enabled="true" />
							<PerfmonCounter name="\Lock Waits/sec" enabled="true" />
							<PerfmonCounter name="\Lock Wait Time (ms)" enabled="true" />
							<PerfmonCounter name="\Average Wait Time (ms)" enabled="true" />
							<PerfmonCounter name="\Average Wait Time Base" enabled="true" />
						</PerfmonObject>
						<PerfmonObject name="\MSSQL$%s:Locks(Database)" enabled="true">
							<PerfmonCounter name="\Lock Requests/sec" enabled="true" />
							<PerfmonCounter name="\Lock Timeouts/sec" enabled="true" />
							<PerfmonCounter name="\Number of Deadlocks/sec" enabled="true" />
							<PerfmonCounter name="\Lock Waits/sec" enabled="true" />
							<PerfmonCounter name="\Lock Wait Time (ms)" enabled="true" />
							<PerfmonCounter name="\Average Wait Time (ms)" enabled="true" />
							<PerfmonCounter name="\Average Wait Time Base" enabled="true" />
						</PerfmonObject>
						<PerfmonObject name="\MSSQL$%s:Locks(_Total)" enabled="true">
							<PerfmonCounter name="\Lock Requests/sec" enabled="true" />
							<PerfmonCounter name="\Lock Timeouts/sec" enabled="true" />
							<PerfmonCounter name="\Number of Deadlocks/sec" enabled="true" />
							<PerfmonCounter name="\Lock Waits/sec" enabled="true" />
							<PerfmonCounter name="\Lock Wait Time (ms)" enabled="true" />
							<PerfmonCounter name="\Average Wait Time (ms)" enabled="true" />
							<PerfmonCounter name="\Average Wait Time Base" enabled="true" />
						</PerfmonObject>
						<PerfmonObject name="\MSSQL$%s:Databases(*)" enabled="true">
							<PerfmonCounter name="\Data File(s) Size (KB)" enabled="true" />
							<PerfmonCounter name="\Log File(s) Size (KB)" enabled="true" />
							<PerfmonCounter name="\Log File(s) Used Size (KB)" enabled="true" />
							<PerfmonCounter name="\Percent Log Used" enabled="true" />
							<PerfmonCounter name="\Active Transactions" enabled="true" />
							<PerfmonCounter name="\Transactions/sec" enabled="true" />
							<PerfmonCounter name="\Repl. Pending Xacts" enabled="true" />
							<PerfmonCounter name="\Repl. Trans. Rate" enabled="true" />
							<PerfmonCounter name="\Log Cache Reads/sec" enabled="true" />
							<PerfmonCounter name="\Log Cache Hit Ratio" enabled="true" />
							<PerfmonCounter name="\Log Cache Hit Ratio Base" enabled="true" />
							<PerfmonCounter name="\Bulk Copy Rows/sec" enabled="true" />
							<PerfmonCounter name="\Bulk Copy Throughput/sec" enabled="true" />
							<PerfmonCounter name="\Backup/Restore Throughput/sec" enabled="true" />
							<PerfmonCounter name="\DBCC Logical Scan Bytes/sec" enabled="true" />
							<PerfmonCounter name="\Shrink Data Movement Bytes/sec" enabled="true" />
							<PerfmonCounter name="\Log Flushes/sec" enabled="true" />
							<PerfmonCounter name="\Log Bytes Flushed/sec" enabled="true" />
							<PerfmonCounter name="\Log Flush Waits/sec" enabled="true" />
							<PerfmonCounter name="\Log Flush Wait Time" enabled="true" />
							<PerfmonCounter name="\Log Truncations" enabled="true" />
							<PerfmonCounter name="\Log Growths" enabled="true" />
							<PerfmonCounter name="\Log Shrinks" enabled="true" />
						</PerfmonObject>
						<PerfmonObject name="\MSSQL$%s:Latches" enabled="true">
							<PerfmonCounter name="\Latch Waits/sec" enabled="true" />
							<PerfmonCounter name="\Average Latch Wait Time (ms)" enabled="true" />
							<PerfmonCounter name="\Average Latch Wait Time Base" enabled="true" />
							<PerfmonCounter name="\Total Latch Wait Time (ms)" enabled="true" />
						</PerfmonObject>
						<PerfmonObject name="\MSSQL$%s:Access Methods" enabled="true">
							<PerfmonCounter name="\Full Scans/sec" enabled="true" />
							<PerfmonCounter name="\Range Scans/sec" enabled="true" />
							<PerfmonCounter name="\Probe Scans/sec" enabled="true" />
							<PerfmonCounter name="\Scan Point Revalidations/sec" enabled="true" />
							<PerfmonCounter name="\Workfiles Created/sec" enabled="true" />
							<PerfmonCounter name="\Worktables Created/sec" enabled="true" />
							<PerfmonCounter name="\Worktables From Cache Ratio" enabled="true" />
							<PerfmonCounter name="\Worktables From Cache Base" enabled="true" />
							<PerfmonCounter name="\Forwarded Records/sec" enabled="true" />
							<PerfmonCounter name="\Skipped Ghosted Records/sec" enabled="true" />
							<PerfmonCounter name="\Index Searches/sec" enabled="true" />
							<PerfmonCounter name="\FreeSpace Scans/sec" enabled="true" />
							<PerfmonCounter name="\FreeSpace Page Fetches/sec" enabled="true" />
							<PerfmonCounter name="\Pages Allocated/sec" enabled="true" />
							<PerfmonCounter name="\Extents Allocated/sec" enabled="true" />
							<PerfmonCounter name="\Mixed page allocations/sec" enabled="true" />
							<PerfmonCounter name="\Extent Deallocations/sec" enabled="true" />